{"actions":[{"id":"Walk","parts":[{"part":"body","views":[{"frame_count":1,"topology":{"kind":"explicit","layers":["body"]},"view":0}]}],"requirement":"REQUIRED"},{"id":"Wave","offline":{"compilation":"UNSUPPORTED","label":"Wave","schema":"rsf.offline-action/v1","timing":{"authority":"EXPLICIT_DIAGNOSTIC_INTERVAL","frame_ms":80,"loop":true}},"parts":[{"part":"body","views":[{"frame_count":4,"topology":{"kind":"explicit","layers":["body"]},"view":0}]}],"requirement":"REQUIRED"}],"actor":{"canonical_sha256":"4ca064799522a3ab4c83b50776ed58ce964aee444363491eeb65a3647ae390bd","id":"custom-actor","revision":1},"canonical_sha256":"07ae0df851e37130e5bea63a25615c606f64472d8878d16a080e54cc9e08bca1","compatibility":{"declarations":[],"status":"UNVERIFIED"},"id":"winter-walk","parts":["body"],"previous_sha256":null,"revision":1,"runtime_profile":{"canonical_sha256":"ed217ae19faa0f078d76fe4bd1c865ea4f0ce2a4d13237682a4a866dbd63429c","id":"korangar-player-v1","profile_version":"1.0.0"},"schema":"rsf.target/v2","scope":"scoped"}
